{
  "contract_version": "1.0.0",
  "package_type": "acceptance_criteria_check_package",
  "task_id": "65.6-nee-1",
  "task_brief_path": "tasks/active-task.md",
  "acceptance_criteria": [
    {"criterion_id": "AC-OPT-1", "description": "Optional validation", "required": false, "check_method": "validation_output", "expected_evidence": ["check-opt"], "notes": ""}
  ],
  "expected_artifacts": [],
  "actual_artifacts": [],
  "changed_files": [],
  "evidence_result": {"source_path": "reports/evidence.json", "result": "M64_EVIDENCE_CHECK_NOT_ENOUGH_EVIDENCE"},
  "validation_outputs": [],
  "known_limitations": [],
  "warnings": [],
  "blockers": [],
  "human_review_required": true,
  "non_authority_boundary": ["Acceptance criteria check package is not approval.", "Acceptance criteria check package does not complete the task.", "Human review remains required."]
}
