{
  "contract_version": "1.0.0",
  "package_type": "acceptance_criteria_check_package",
  "task_id": "65.6-pos-2",
  "task_brief_path": "tasks/active-task.md",
  "acceptance_criteria": [
    {
      "criterion_id": "AC-1",
      "description": "Required artifact exists",
      "required": true,
      "check_method": "artifact_presence",
      "expected_evidence": ["docs/a.md"],
      "notes": ""
    },
    {
      "criterion_id": "AC-2",
      "description": "Declared change exists",
      "required": true,
      "check_method": "declared_change",
      "expected_evidence": ["scripts/a.sh"],
      "notes": ""
    }
  ],
  "expected_artifacts": [
    {"path": "docs/a.md", "artifact_type": "document", "required": true},
    {"path": "scripts/a.sh", "artifact_type": "script", "required": true}
  ],
  "actual_artifacts": [
    {"path": "docs/a.md", "artifact_type": "document", "required": true},
    {"path": "scripts/a.sh", "artifact_type": "script", "required": true}
  ],
  "changed_files": ["docs/a.md", "scripts/a.sh"],
  "evidence_result": {"source_path": "reports/evidence.json", "result": "M64_EVIDENCE_CHECK_PASS"},
  "validation_outputs": [],
  "known_limitations": [],
  "warnings": [],
  "blockers": [],
  "human_review_required": true,
  "non_authority_boundary": [
    "Acceptance criteria check package is not approval.",
    "Acceptance criteria check package does not complete the task.",
    "Human review remains required."
  ]
}
